{
  "$schema": "./skills.config.schema.json",
  "project": {
    "name": "My Project",
    "conventionsFile": "CLAUDE.md"
  },
  "docs": {
    "root": ".docs",
    "indexFile": ".docs/index.md",
    "capabilitiesRoot": "capabilities"
  },
  "code": {
    "appRoot": "apps/my-app",
    "searchRoots": ["apps/my-app/lib/features"]
  },
  "workflow": {
    "implementationFlow": [
      {
        "phase": "Surface / entry point",
        "skills": [],
        "notes": "Screens, pages, commands, routes, jobs, or API entry points."
      },
      {
        "phase": "Orchestration",
        "skills": [],
        "notes": "Controllers, hooks, blocs, services, state, loading, errors, and wiring."
      },
      {
        "phase": "Data / contracts",
        "skills": [],
        "notes": "Repositories, clients, schemas, migrations, generated types, or external contracts."
      },
      {
        "phase": "Validation and review",
        "skills": [],
        "agents": [],
        "notes": "Tests, lint, typecheck, manual checks, code review, and documentation finalization. Optional: list project-specific subagents (e.g. .claude/agents/code-reviewer.md) in 'agents' for this phase."
      }
    ],
    "validationCommands": [],
    "review": {
      "instructions": "Use the project's normal review path; use a review agent for broad or cross-layer changes.",
      "agents": ["code-reviewer"]
    },
    "docsFinalization": {
      "instructions": "Update docs.indexFile when domains, use cases, actors, domain rules hubs, capabilities, or navigation change. Use cases: update <use-case>.spec.md and append a changelog.md line when something shipped or was fixed. Actors: update actor docs and actors/actors.index.md when definitions or relationships change. Domain rules: update <domain>/<domain>.rules.md when rules are shared within one domain. Capabilities: update <capability>.rules.md and <capability>.scenarios.md when rules cross more than one domain. Remove transient plan.md and tasks.md files after merge.",
      "agents": ["spec-reviewer"]
    }
  }
}
